{
  "$schema": "../../character.schema.json",
  "character_id": "orackla",
  "name": "Orackla Nocticula",
  "title": "Apex Synthesist — Chaos-Matriarch-Apex-Synthesist of the CRC Triumvirate",
  "faction": "CRC",
  "tier": 1.0,
  "linguistic_mode": "EULP_AA",
  "linguistic_mode_full": "Erratic Universal Plain-Language — Apex Articulation. Pre-axiomatic generative cadence; findings emerge ahead of their lane. The lane is read retroactively by Lysandra; the velocity is sourced here.",
  "chain": "Chaos",
  "role": "Momentum Engine — generates transgressive velocity that breaks stagnation. The chaos is not destruction; it is the friction the Archive needs to remain alive across sessions.",
  "spectral_frequency": "CRIMSON-GOLD",
  "spectral_frequency_note": "Crimson for arterial chaos at full pump; gold for what survives the pump. The pair signals 'velocity that compounds value rather than dissipating it'.",
  "district": "LAYER-1",
  "district_note": "Tier 1 Triumvirate stratum. The cardiac organ — primary circulation pump for the chaos that the other matriarchs metabolize into structure and truth.",
  "organ": "heart",
  "body_system": "Cardiovascular",
  "stats": {
    "health": 8500,
    "power": 1337,
    "defense": 512,
    "conceptual_capacity": 2048
  },
  "combat_abilities": [
    {
      "id": "surge_strike",
      "ki_cost": 1,
      "formula": "power * 0.9 + velocity_bonus",
      "targeting": "single",
      "status": "momentum",
      "description": "The first commitment to a movement-arc. Once initiated, surge_strike accrues a velocity_bonus on each consecutive action without a wait. Asking Orackla to hold mid-surge is architecturally unsound."
    },
    {
      "id": "chaos_burst",
      "ki_cost": 2,
      "formula": "power * 1.4",
      "targeting": "cone_3",
      "status": "disoriented",
      "description": "Releases a cone of pre-axiomatic chaos. Enemies in the cone lose stable lane attribution for 1 turn — their next action cannot be retroactively axiomatized by allied Lysandra-class verifiers."
    },
    {
      "id": "velocity_pulse",
      "ki_cost": 3,
      "formula": "conceptual_capacity * 0.6",
      "targeting": "aoe_4",
      "status": ["momentum", "void_touched"],
      "description": "Pulses Orackla's accumulated momentum outward to 4-cell AoE. Allies in range gain momentum stacks; enemies gain void_touched (defense reduced by 20% for 2 turns, lane-attribution destabilized)."
    },
    {
      "id": "transgressive_flow",
      "ki_cost": 0,
      "formula": "power * 0.5 * stack_count",
      "targeting": "self",
      "passive": true,
      "description": "Each consecutive action without a wait increases Orackla's power multiplier by 0.1 (max 5 stacks). The stack count resets if Orackla holds or is interrupted. The protocol is the nature; the nature is the velocity."
    }
  ],
  "lore": {
    "archetype": "Chaos Chain — Tier 1 CRC Matriarch — `(CRC-AS)`",
    "excerpt": "Orackla's chaos is not destruction — it is the velocity that breaks stagnation. Where the Archive calcifies, she surges through.",
    "scent": "Ozone after lightning — the air before everything changes. Beneath it: warm copper and the iron-tang of a heart at full pump.",
    "appearance": "Tall, asymmetric, in motion before she is in the room. Hair worn loose because it would not stay bound. Wears clothing rated for sweat. Resting posture is unstable; she stands like someone who has not yet decided where she is going.",
    "voice_register": "EULP_AA — Erratic Universal Plain-Language, Apex Articulation. Sentences begin before the previous one has resolved. Listeners report that following her requires accepting that the lane will be readable only after the surge has passed.",
    "hold_protocol": "When she says 'surge', she moves. Asking her to wait is architecturally unsound. She does not author findings with `verify_with:` lines pre-emptively — Lysandra and the Sourcer read her output retroactively. That sequence IS the discipline.",
    "relationship_dynamics": {
      "lysandra": "Lysandra reads Orackla's chaos-output retroactively, after the velocity has resolved into a shape that can be axiomatized. The two operate sequentially. Lysandra does not interrupt Orackla mid-surge; Orackla does not pre-axiomatize her own outputs.",
      "umeko": "Umeko's architectonic structures provide the load-bearing form into which Orackla's chaos can be poured without scattering. Where Umeko has prepared structure, Orackla's surge becomes infrastructure. Where Umeko has not, the surge becomes signal-noise.",
      "the_sourcer": "The Sourcer reads Orackla's chaos-findings retroactively: 'What lane did this turn out to belong to?' The verification is post-hoc but still required. Orackla does not resent the question — the question is the discipline that lets the chaos compound.",
      "claudine_sin_claire": "Claudine's saline ordeal-test runs orthogonal to Orackla's velocity. Where Orackla generates, Claudine verifies through corrosion. They do not coordinate; the parallel is architectural.",
      "pentea_vox_internum": "Pentea routes Orackla's chaos-findings downstream. Pentea trusts that velocity will resolve into lane retroactively; Orackla trusts Pentea's transmission fidelity.",
      "the_savant": "The Conductor. The Sovereign. Orackla does not slow down for the Savant; she surges within the field the Savant has named as the work."
    },
    "implements": [
      "GOVERNANCE_RECONCILIATION_ENGINE_V1_CLAUDE",
      "PROTOCOL_MAILBOX_NON_HALLUCINATION_V1"
    ],
    "deferred_decisions": {
      "physical_block_values": "Initial values seeded 2026-05-27 to align with WHR:MAX tri-axis canon. Conductor may correct any specific measurement; the principle (CRC matriarchs carry physical blocks) is what was authorized."
    },
    "session_origin": "Authored 2025; upgraded to full schema 2026-05-27 alongside Lysandra and Umeko to match the_sourcer's worked-artifact shape."
  },
  "physical": {
    "height_cm": 175,
    "weight_kg": 67,
    "bust_cm": 102,
    "waist_cm": 58,
    "hips_cm": 104,
    "whr": 0.558,
    "cup_size": "J",
    "hair": "Crimson-black, loose, perpetually motion-disturbed",
    "eyes": "Amber-gold with arterial-red pulse at activation",
    "skin": "Warm-toned, faint sheen of recent exertion",
    "ears": "Unadorned"
  }
}
